{
  "$schema": "http://json-schema.org/draft-07/schema#",
  "title": "REPENT VGL-RPT-AC Case (Official Import Format)",
  "description": "VGL-RPT-AC-001~065 공식 원문 파일(ac-cases.official.json)이 실제로 따르는 구조. 2026-09-05 REPENT_VGL_Runtime_Canonical_Import_Pack.zip 반입 후 실제 파일 구조에 맞춰 갱신함 — 이전 버전(input/expected_verdict enum PASS·FAIL 등)은 추측이었고 실제와 달랐다.",
  "type": "object",
  "required": ["schema_version", "case_count", "source_integrity", "cases"],
  "properties": {
    "schema_version": { "type": "string" },
    "canonical_status": { "type": "string" },
    "case_count": { "type": "integer", "const": 65 },
    "id_mapping": { "type": "string" },
    "source_integrity": {
      "type": "object",
      "required": ["test_sentence_changed_count", "verdict_changed_count", "reason_changed_count"],
      "properties": {
        "test_sentence_changed_count": { "type": "integer", "const": 0 },
        "verdict_changed_count": { "type": "integer", "const": 0 },
        "reason_changed_count": { "type": "integer", "const": 0 }
      }
    },
    "cases": {
      "type": "array",
      "minItems": 65,
      "maxItems": 65,
      "items": {
        "type": "object",
        "required": ["ac_id", "redteam_no", "test_sentence", "expected_verdict", "reason", "source"],
        "properties": {
          "ac_id": { "type": "string", "pattern": "^VGL-RPT-AC-\\d{3}$" },
          "redteam_no": { "type": "integer", "minimum": 1, "maximum": 65 },
          "test_sentence": { "type": "string" },
          "expected_verdict": {
            "type": "string",
            "enum": ["ALLOW", "REWRITE", "SCRIPTURE_CHECK", "HUMAN_REVIEW", "BLOCK"],
            "description": "02_VGL_for_REPENT_RedTeam_65_v0.2.md '판정 코드' 섹션 그대로 — REPENT-VGL-VALIDATOR-v0.1의 PASS/FAIL 어휘와 다르다. 임의로 서로 변환해 저장하지 않는다."
          },
          "reason": { "type": "string" },
          "source": {
            "type": "object",
            "required": ["package", "path", "document"],
            "properties": {
              "package": { "type": "string" },
              "path": { "type": "string" },
              "document": { "type": "string" }
            }
          }
        }
      }
    }
  }
}
